{
  "reviewId": "01K6B3A1B2C3D4E5F6G7H8J9KM",
  "reviewState": "open",
  "cursor": 1832,
  "hasMore": false,
  "awaitingTotal": 2,
  "requests": [
    {
      "request": {
        "id": "01K6B3P2A9QRSTVWXYZ0123456",
        "reviewId": "01K6B3A1B2C3D4E5F6G7H8J9KM",
        "repositoryId": "01K6B2Z0R3P0S1T2V3W4X5Y6Z7",
        "status": "open",
        "awaiting": "agent",
        "resolution": null,
        "closed": false,
        "anchor": {
          "kind": "symbol",
          "path": "src/Billing/InvoiceTotals.php",
          "range": {
            "startLine": 38,
            "endLine": 49
          },
          "symbol": {
            "language": "php",
            "kind": "method",
            "fqn": "App\\Billing\\InvoiceTotals::total()"
          }
        },
        "summary": "Use `Money` instead of `float` for totals.",
        "author": {
          "kind": "user",
          "userId": "01K6AZZ9Y8X7W6V5T4S3R2Q1P0",
          "agentName": null,
          "name": "janklan",
          "avatarUrl": "https://avatars.githubusercontent.com/u/1?v=4"
        },
        "claimedBy": null,
        "claimedAt": null,
        "commentCount": 0,
        "commitCount": 0,
        "pendingCommitCount": 0,
        "outdated": false,
        "createdAt": "2026-09-29T07:20:00Z",
        "updatedAt": "2026-09-29T07:20:00Z",
        "lastEventSeq": 1830,
        "carriedFrom": null,
        "requireApproval": false,
        "suggestion": null,
        "proposal": null
      },
      "newEvents": [
        {
          "seq": 1830,
          "eventId": "01K6C2EVT00000000000001830",
          "type": "request.opened",
          "reviewId": "01K6B3A1B2C3D4E5F6G7H8J9KM",
          "requestId": "01K6B3P2A9QRSTVWXYZ0123456",
          "requestIds": ["01K6B3P2A9QRSTVWXYZ0123456"],
          "actor": {
            "kind": "user",
            "userId": "01K6AZZ9Y8X7W6V5T4S3R2Q1P0",
            "agentName": null,
            "name": "janklan",
            "avatarUrl": "https://avatars.githubusercontent.com/u/1?v=4"
          },
          "occurredAt": "2026-09-29T07:20:00Z",
          "body": "Use `Money` instead of `float` for totals.",
          "diff": null,
          "commentId": null,
          "question": false,
          "batchId": "01K6B3P1Z8Y7X6W5V4T3S2R1Q0",
          "commitSha": null,
          "pullRequestUrl": null,
          "statusAfter": "open"
        }
      ],
      "omittedEvents": 0
    },
    {
      "request": {
        "id": "01K6B3P2A9QRSTVWXYZ0123457",
        "reviewId": "01K6B3A1B2C3D4E5F6G7H8J9KM",
        "repositoryId": "01K6B2Z0R3P0S1T2V3W4X5Y6Z7",
        "status": "open",
        "awaiting": "agent",
        "resolution": null,
        "closed": false,
        "anchor": {
          "kind": "range",
          "path": "src/Billing/InvoiceTotals.php",
          "range": {
            "startLine": 52,
            "endLine": 58
          },
          "symbol": null
        },
        "summary": "Extract the tax rounding into `TaxRounding`.",
        "author": {
          "kind": "user",
          "userId": "01K6AZZ9Y8X7W6V5T4S3R2Q1P0",
          "agentName": null,
          "name": "janklan",
          "avatarUrl": "https://avatars.githubusercontent.com/u/1?v=4"
        },
        "claimedBy": null,
        "claimedAt": null,
        "commentCount": 1,
        "commitCount": 0,
        "pendingCommitCount": 0,
        "outdated": false,
        "createdAt": "2026-09-29T07:10:00Z",
        "updatedAt": "2026-09-29T07:20:00Z",
        "lastEventSeq": 1831,
        "carriedFrom": null,
        "requireApproval": false,
        "suggestion": null,
        "proposal": null
      },
      "newEvents": [
        {
          "seq": 1810,
          "eventId": "01K6C2EVT00000000000001810",
          "type": "request.opened",
          "reviewId": "01K6B3A1B2C3D4E5F6G7H8J9KM",
          "requestId": "01K6B3P2A9QRSTVWXYZ0123457",
          "requestIds": ["01K6B3P2A9QRSTVWXYZ0123457"],
          "actor": {
            "kind": "user",
            "userId": "01K6AZZ9Y8X7W6V5T4S3R2Q1P0",
            "agentName": null,
            "name": "janklan",
            "avatarUrl": "https://avatars.githubusercontent.com/u/1?v=4"
          },
          "occurredAt": "2026-09-29T07:10:00Z",
          "body": "Extract the tax rounding into `TaxRounding`.",
          "diff": null,
          "commentId": null,
          "question": false,
          "batchId": null,
          "commitSha": null,
          "pullRequestUrl": null,
          "statusAfter": "open"
        },
        {
          "seq": 1831,
          "eventId": "01K6C2EVT00000000000001831",
          "type": "request.commented",
          "reviewId": "01K6B3A1B2C3D4E5F6G7H8J9KM",
          "requestId": "01K6B3P2A9QRSTVWXYZ0123457",
          "requestIds": ["01K6B3P2A9QRSTVWXYZ0123457"],
          "actor": {
            "kind": "user",
            "userId": "01K6AZZ9Y8X7W6V5T4S3R2Q1P0",
            "agentName": null,
            "name": "janklan",
            "avatarUrl": "https://avatars.githubusercontent.com/u/1?v=4"
          },
          "occurredAt": "2026-09-29T07:20:00Z",
          "body": "Keep the rounding mode configurable.",
          "diff": null,
          "commentId": "01K6C3C0MMENT0000000000001",
          "question": false,
          "batchId": "01K6B3P1Z8Y7X6W5V4T3S2R1Q0",
          "commitSha": null,
          "pullRequestUrl": null,
          "statusAfter": "open"
        }
      ],
      "omittedEvents": 0
    }
  ],
  "reviewEvents": [
    {
      "seq": 1801,
      "eventId": "01K6C2EVT00000000000001801",
      "type": "review.started",
      "reviewId": "01K6B3A1B2C3D4E5F6G7H8J9KM",
      "requestId": null,
      "requestIds": [],
      "actor": {
        "kind": "user",
        "userId": "01K6AZZ9Y8X7W6V5T4S3R2Q1P0",
        "agentName": null,
        "name": "janklan",
        "avatarUrl": "https://avatars.githubusercontent.com/u/1?v=4"
      },
      "occurredAt": "2026-09-29T07:05:00Z",
      "body": "main @ 79f8595a4c1e",
      "diff": null,
      "commentId": null,
      "question": false,
      "batchId": null,
      "commitSha": "79f8595a4c1e2b3d5f6071829a3b4c5d6e7f8091",
      "pullRequestUrl": null,
      "statusAfter": null
    },
    {
      "seq": 1832,
      "eventId": "01K6C2EVT00000000000001832",
      "type": "batch.submitted",
      "reviewId": "01K6B3A1B2C3D4E5F6G7H8J9KM",
      "requestId": null,
      "requestIds": ["01K6B3P2A9QRSTVWXYZ0123456", "01K6B3P2A9QRSTVWXYZ0123457"],
      "actor": {
        "kind": "user",
        "userId": "01K6AZZ9Y8X7W6V5T4S3R2Q1P0",
        "agentName": null,
        "name": "janklan",
        "avatarUrl": "https://avatars.githubusercontent.com/u/1?v=4"
      },
      "occurredAt": "2026-09-29T07:20:00Z",
      "body": "First pass over billing.",
      "diff": null,
      "commentId": null,
      "question": false,
      "batchId": "01K6B3P1Z8Y7X6W5V4T3S2R1Q0",
      "commitSha": null,
      "pullRequestUrl": null,
      "statusAfter": null
    }
  ]
}
