{
  "reviewId": "01K6B3A1B2C3D4E5F6G7H8J9KM",
  "reviewState": "open",
  "cursor": 1850,
  "hasMore": false,
  "awaitingTotal": 1,
  "requests": [
    {
      "request": {
        "id": "01K6B3P2A9QRSTVWXYZ0123456",
        "reviewId": "01K6B3A1B2C3D4E5F6G7H8J9KM",
        "repositoryId": "01K6B2Z0R3P0S1T2V3W4X5Y6Z7",
        "status": "in_progress",
        "awaiting": "agent",
        "resolution": null,
        "closed": false,
        "anchor": {
          "kind": "symbol",
          "path": "src/Billing/InvoiceTotals.php",
          "range": {
            "startLine": 38,
            "endLine": 49
          },
          "symbol": {
            "language": "php",
            "kind": "method",
            "fqn": "App\\Billing\\InvoiceTotals::total()"
          }
        },
        "title": null,
        "summary": "Use Money instead of float for totals.",
        "author": {
          "kind": "user",
          "userId": "01K6AZZ9Y8X7W6V5T4S3R2Q1P0",
          "agentName": null,
          "name": "janklan",
          "avatarUrl": "https://avatars.githubusercontent.com/u/1?v=4"
        },
        "claimedBy": {
          "kind": "agent",
          "userId": "01K6AZZ9Y8X7W6V5T4S3R2Q1P0",
          "agentName": "claude-code laptop",
          "name": "claude-code laptop",
          "avatarUrl": null
        },
        "claimedAt": "2026-09-29T07:40:00Z",
        "commentCount": 1,
        "commitCount": 1,
        "pendingCommitCount": 0,
        "outdated": false,
        "createdAt": "2026-09-29T07:20:00Z",
        "updatedAt": "2026-09-29T07:50:00Z",
        "lastEventSeq": 1850,
        "carriedFrom": null,
        "requireApproval": false,
        "suggestion": null,
        "proposal": null
      },
      "newEvents": [
        {
          "seq": 1850,
          "eventId": "01K6C2EVT00000000000001850",
          "type": "request.commented",
          "reviewId": "01K6B3A1B2C3D4E5F6G7H8J9KM",
          "requestId": "01K6B3P2A9QRSTVWXYZ0123456",
          "requestIds": ["01K6B3P2A9QRSTVWXYZ0123456"],
          "actor": {
            "kind": "user",
            "userId": "01K6AZZ9Y8X7W6V5T4S3R2Q1P0",
            "agentName": null,
            "name": "janklan",
            "avatarUrl": "https://avatars.githubusercontent.com/u/1?v=4"
          },
          "occurredAt": "2026-09-29T07:50:00Z",
          "body": "Keep the old method as deprecated for one release.",
          "diff": null,
          "commentId": "01K6C3C0MMENT0000000000002",
          "question": false,
          "batchId": null,
          "commitSha": null,
          "pullRequestUrl": null,
          "statusAfter": "in_progress"
        }
      ],
      "omittedEvents": 0
    }
  ],
  "reviewEvents": []
}
